{
  "SPDX-License-Identifier": "MIT",
  "attemptCount": 38,
  "attempts": [
    {
      "file": "gd-current-supported-kernel-gpio4.json",
      "operationId": "gd-current-supported-kernel-gpio4",
      "sha256": "3a5271f0e789ef3223d20d2fc3484b73884e07f9587a282b2deb53055d0f3985"
    },
    {
      "file": "gd-current-supported-kernel-gpio20.json",
      "operationId": "gd-current-supported-kernel-gpio20",
      "sha256": "488acb16ff470d38ce9ab38e0abbb457220a5dea73624f749eada57e0a4a52bc"
    },
    {
      "file": "gd-prior-supported-kernel-downgrade-gpio4.json",
      "operationId": "gd-prior-supported-kernel-downgrade-gpio4",
      "sha256": "0834b18e59821dae1dfa6f29d08c3ec10f04331f275b294f181f0a1fa29e9403"
    },
    {
      "file": "gd-prior-supported-kernel-downgrade-gpio20.json",
      "operationId": "gd-prior-supported-kernel-downgrade-gpio20",
      "sha256": "8db7f588e4963922cc50b37cea3289fdd11e536addd0168c384f0f0bb0670f89"
    },
    {
      "file": "gd-signing-not-enforced-gpio4.json",
      "operationId": "gd-signing-not-enforced-gpio4",
      "sha256": "7e059fa60b11616ff65057683aebbfd5e1b62e8ac91b4d1b8db269ae35cca7ba"
    },
    {
      "file": "gd-signing-not-enforced-gpio20.json",
      "operationId": "gd-signing-not-enforced-gpio20",
      "sha256": "4b616b523e128be8439ccac19cb281a1069c4495855cb26a9d5b551439b39cbd"
    },
    {
      "file": "gd-deliberate-build-failure-compiler-wrapper.json",
      "operationId": "gd-deliberate-build-failure-compiler-wrapper",
      "sha256": "8a9b63c8c8f11f3ff5d250dbf32b03f8a3cde6051625eb9dcaf32391343c4824"
    },
    {
      "file": "gd-interrupted-upgrade-after-preflight.json",
      "operationId": "gd-interrupted-upgrade-after-preflight",
      "sha256": "eeb590ee14f819e7c7fa15c6c73debd37d88d8c6714621cf7deca28f62e57f69"
    },
    {
      "file": "gd-interrupted-upgrade-after-retain-predecessor.json",
      "operationId": "gd-interrupted-upgrade-after-retain-predecessor",
      "sha256": "89b3704ea62b7f89ca713a0edc00999761f6bcb8ff3f1a1a2a7ce25b12e6716b"
    },
    {
      "file": "gd-interrupted-upgrade-after-dkms-add.json",
      "operationId": "gd-interrupted-upgrade-after-dkms-add",
      "sha256": "f235e10f9f4701015b2b61c1783ca13e714cc3ff2d2ceda89dcbba14e9f5c46a"
    },
    {
      "file": "gd-interrupted-upgrade-after-dkms-build.json",
      "operationId": "gd-interrupted-upgrade-after-dkms-build",
      "sha256": "353f0465582283399629464dc3e5d99ab9433e760490a17fd9e58d782874c9e7"
    },
    {
      "file": "gd-interrupted-upgrade-after-dkms-install.json",
      "operationId": "gd-interrupted-upgrade-after-dkms-install",
      "sha256": "dd50e6f78e880641d59f8a4dbf02f4c7f23ef05895f75ce240a919d99820b8e0"
    },
    {
      "file": "gd-interrupted-upgrade-after-load-disabled.json",
      "operationId": "gd-interrupted-upgrade-after-load-disabled",
      "sha256": "0c044c1e05db91cbcf1a5c9a5853e3b660475b56d0932194986229b391d840f4"
    },
    {
      "file": "gd-interrupted-upgrade-after-query-disabled.json",
      "operationId": "gd-interrupted-upgrade-after-query-disabled",
      "sha256": "48a9a1988dd62df306b4f3f7128e9160e221f8d7c5714eec633a5bbebc469adc"
    },
    {
      "file": "gd-interrupted-upgrade-after-uapi-query-release.json",
      "operationId": "gd-interrupted-upgrade-after-uapi-query-release",
      "sha256": "145f2d99fb54ecf7c790698d43015a5a208b75016fcfef23b8c617fa3a7fffb4"
    },
    {
      "file": "gd-interrupted-upgrade-after-unbind-bind.json",
      "operationId": "gd-interrupted-upgrade-after-unbind-bind",
      "sha256": "b40855cb505be00e9ffa3fef705e0253e8bcf8245f8afae385298431f7cce6ce"
    },
    {
      "file": "gd-interrupted-upgrade-after-unload.json",
      "operationId": "gd-interrupted-upgrade-after-unload",
      "sha256": "534ceae2b02f9c53b25ea58b11b08e9c7986a64cf3763ede805b2dc7c9704c8c"
    },
    {
      "file": "gd-interrupted-upgrade-after-dkms-uninstall.json",
      "operationId": "gd-interrupted-upgrade-after-dkms-uninstall",
      "sha256": "60a6fae3ed85c69a8ea81117656eeabafc9cc2d2900e2068a4bc8d41bf2e47af"
    },
    {
      "file": "gd-interrupted-upgrade-after-dkms-remove.json",
      "operationId": "gd-interrupted-upgrade-after-dkms-remove",
      "sha256": "4de0be9469a2576bfeb374aa3b10182e6bb1d6efed4f530eeca32066dbb6c642"
    },
    {
      "file": "gd-interrupted-upgrade-after-owned-residue-remove.json",
      "operationId": "gd-interrupted-upgrade-after-owned-residue-remove",
      "sha256": "9febdeae087b8e4a9345aeb03e468f86c329d960af29a47d64dd035bb16f3622"
    },
    {
      "file": "gd-interrupted-upgrade-after-verify-final-state.json",
      "operationId": "gd-interrupted-upgrade-after-verify-final-state",
      "sha256": "f76c21d5a28d5542cec1975ad935c615f01ca46ce923b115a80b68f1652ec31f"
    },
    {
      "file": "gd-interrupted-upgrade-after-commit-state.json",
      "operationId": "gd-interrupted-upgrade-after-commit-state",
      "sha256": "c7d96dabe455a0588d0506d28e35edd40744eb3e173d3f1a0bdf4346f2a1a362"
    },
    {
      "file": "gd-stale-manifest-release.json",
      "operationId": "gd-stale-manifest-release",
      "sha256": "72bb3396c22776aa9d066b44edb9f3f7bb7fb9763106ff5f799f219b24507134"
    },
    {
      "file": "gd-stale-manifest-kernel.json",
      "operationId": "gd-stale-manifest-kernel",
      "sha256": "1266a051d8bfbc455666de51daa1f2127709811dd9894033ee47ef8acf49c087"
    },
    {
      "file": "gd-stale-manifest-uapi.json",
      "operationId": "gd-stale-manifest-uapi",
      "sha256": "8e0a1e2ee3d78e4afc9abc55ada3740f3889b47cc39aacc9f633819c9a18d338"
    },
    {
      "file": "gd-stale-manifest-gpio4-overlay.json",
      "operationId": "gd-stale-manifest-gpio4-overlay",
      "sha256": "134a079be27bb7e17cec825146b4afd62be472314f3de9d0cc61f8534fbb6098"
    },
    {
      "file": "gd-stale-manifest-gpio20-overlay.json",
      "operationId": "gd-stale-manifest-gpio20-overlay",
      "sha256": "f77eeab3cb7dfaea8f48be85208f1e0240fe76f5a1053642ca8ebf6982b05f20"
    },
    {
      "file": "gd-stale-manifest-enrollment.json",
      "operationId": "gd-stale-manifest-enrollment",
      "sha256": "376833584bad7443a6245375f72dbeda7b63f29dc5186e42e9de4229cce75b32"
    },
    {
      "file": "gd-corrupted-archive-or-dtbo-archive.json",
      "operationId": "gd-corrupted-archive-or-dtbo-archive",
      "sha256": "ecb416b67417fe2eb4005ca1d0d469fe854d593c485a7e4217ab8956c80dc65d"
    },
    {
      "file": "gd-corrupted-archive-or-dtbo-gpio4-dtbo.json",
      "operationId": "gd-corrupted-archive-or-dtbo-gpio4-dtbo",
      "sha256": "966259402e2d7c6a6a26fffc537889bac9409d9d6b14efc09d17df78ef783383"
    },
    {
      "file": "gd-corrupted-archive-or-dtbo-gpio20-dtbo.json",
      "operationId": "gd-corrupted-archive-or-dtbo-gpio20-dtbo",
      "sha256": "1d2d07d5c2aaea501909848c68c0887b16cc761857c170374e6c656ed1a5dc8e"
    },
    {
      "file": "gd-removal-inactive-complete-removal.json",
      "operationId": "gd-removal-inactive-complete-removal",
      "sha256": "7a8cd9c620287a06c13d9b50ac083efba223ed1d9656486c663262f98511c843"
    },
    {
      "file": "gd-removal-open-or-active-open-gpio4.json",
      "operationId": "gd-removal-open-or-active-open-gpio4",
      "sha256": "7edd23ef120aaebe062c592e3966abf5ed79ec4f39072e7197d717405d89a60e"
    },
    {
      "file": "gd-removal-open-or-active-owner-gpio4.json",
      "operationId": "gd-removal-open-or-active-owner-gpio4",
      "sha256": "d4f7d20722375e140768780da86a6421582e815b22462b4d5ae6896f7ff66d3b"
    },
    {
      "file": "gd-removal-open-or-active-open-gpio20.json",
      "operationId": "gd-removal-open-or-active-open-gpio20",
      "sha256": "81383b7618951ed1c8f49681e4cfd674363a31c0252e80704bb10e7659594ce2"
    },
    {
      "file": "gd-removal-open-or-active-owner-gpio20.json",
      "operationId": "gd-removal-open-or-active-owner-gpio20",
      "sha256": "a4282e02684a7bb14f05df4c7fea012c1e10f5ec52adc09617b68d706bcf611d"
    },
    {
      "file": "gd-reinstall-after-removal-gpio4.json",
      "operationId": "gd-reinstall-after-removal-gpio4",
      "sha256": "b6c1d63315a64904d8d29a821c0df3a641a8d24c8be380cef0c5032f5fe9ae03"
    },
    {
      "file": "gd-reinstall-after-removal-gpio20.json",
      "operationId": "gd-reinstall-after-removal-gpio20",
      "sha256": "5fb7f24596c4afb0975426a2ab3c948d6dc5e5f55fc4988a3739d79ce0f111a7"
    }
  ],
  "executors": {
    "attemptGenerator": {
      "path": "scripts/gate_d_attempts.py",
      "sha256": "7b9f4f20dcf731fab330b00783167b7d652cda9bbf80c12ff3931c41b9f67174"
    },
    "permanentExecutor": {
      "path": "scripts/gate_d_outer.py",
      "sha256": "1d93c918a57414d379b9bd6af3ae170195687c93d017c55595cb5c0750c57917"
    }
  },
  "kind": "gate-d-attempt-index",
  "qualificationRoot": {
    "identityFile": ".gate-d-root.json",
    "identitySha256": "feb0d12cf770d241a2740867fa69b20c9e2d44d2d1d6f4c4292053114e781b32",
    "mode": "0700",
    "ownerUid": 1000,
    "path": "/home/pi/gate-d-qualification/phase5.46-b43e2744b212"
  },
  "schemaVersion": 2
}
