{
  "SPDX-License-Identifier": "MIT",
  "attemptCount": 38,
  "attempts": [
    {
      "file": "gd-current-supported-kernel-gpio4.json",
      "operationId": "gd-current-supported-kernel-gpio4",
      "sha256": "8cd28c60e0ac9682e8daa85f04e65f369b35a74d45d0d1df1a77361a829d20fe"
    },
    {
      "file": "gd-current-supported-kernel-gpio20.json",
      "operationId": "gd-current-supported-kernel-gpio20",
      "sha256": "f2999e2e84531ca0b97653715ca1e178da5e64357a302d51189d6d8cd0a68f2b"
    },
    {
      "file": "gd-prior-supported-kernel-downgrade-gpio4.json",
      "operationId": "gd-prior-supported-kernel-downgrade-gpio4",
      "sha256": "f3b259cb8ea7dfc245bfe5187bcedd968cc2f9101428494c5a3a9c9e0e9cf226"
    },
    {
      "file": "gd-prior-supported-kernel-downgrade-gpio20.json",
      "operationId": "gd-prior-supported-kernel-downgrade-gpio20",
      "sha256": "886f76509cdf6f31bc72fe165ad88b09681474d4a79c709367422e506909f324"
    },
    {
      "file": "gd-signing-not-enforced-gpio4.json",
      "operationId": "gd-signing-not-enforced-gpio4",
      "sha256": "bc266302173b93d78fb8803b140d7d266bfc18e7b88ab4d238c99ee604ae3efb"
    },
    {
      "file": "gd-signing-not-enforced-gpio20.json",
      "operationId": "gd-signing-not-enforced-gpio20",
      "sha256": "4da1c1d8a6b85d5422fd343b9ec9c6302a3ddbd50847c359bce7d17553c452a9"
    },
    {
      "file": "gd-deliberate-build-failure-compiler-wrapper.json",
      "operationId": "gd-deliberate-build-failure-compiler-wrapper",
      "sha256": "38f0f444c13f1b9daced6bb72ffde7dd47c9dba07c834569cff14af9230fd057"
    },
    {
      "file": "gd-interrupted-upgrade-after-preflight.json",
      "operationId": "gd-interrupted-upgrade-after-preflight",
      "sha256": "0de395a9b5361744a1233431a72fd9cfab91041fc34ac990d8a1532b2eece803"
    },
    {
      "file": "gd-interrupted-upgrade-after-retain-predecessor.json",
      "operationId": "gd-interrupted-upgrade-after-retain-predecessor",
      "sha256": "4a6af677bc904e2537cee5f892fcae0936198e69e3d0eced62316acf9357195f"
    },
    {
      "file": "gd-interrupted-upgrade-after-dkms-add.json",
      "operationId": "gd-interrupted-upgrade-after-dkms-add",
      "sha256": "51b3a485872ce318256d5469ae83e1ff90f3a4bc45ce50a45dff90c8cb89eb8c"
    },
    {
      "file": "gd-interrupted-upgrade-after-dkms-build.json",
      "operationId": "gd-interrupted-upgrade-after-dkms-build",
      "sha256": "26de5ddb36e0b76981177555d92716fdabfb37bef4b2760e3b781adb24b687bb"
    },
    {
      "file": "gd-interrupted-upgrade-after-dkms-install.json",
      "operationId": "gd-interrupted-upgrade-after-dkms-install",
      "sha256": "335f38a6b55c73d5995501d21aa02a39ce4b63b015db82a1ddae46b781a54185"
    },
    {
      "file": "gd-interrupted-upgrade-after-load-disabled.json",
      "operationId": "gd-interrupted-upgrade-after-load-disabled",
      "sha256": "37ba3d873cfdd435649737e358e69eb0b369035924c45b1982faf15a2ece680b"
    },
    {
      "file": "gd-interrupted-upgrade-after-query-disabled.json",
      "operationId": "gd-interrupted-upgrade-after-query-disabled",
      "sha256": "6f43e3ff48f55525e52786fa5abdfcc7d833191a6eedf498e5b66690a9a8cd50"
    },
    {
      "file": "gd-interrupted-upgrade-after-uapi-query-release.json",
      "operationId": "gd-interrupted-upgrade-after-uapi-query-release",
      "sha256": "d8c382e81bac6b0a49a3f865244796a8d55b392dd21c0ec926a436c69ac0c00d"
    },
    {
      "file": "gd-interrupted-upgrade-after-unbind-bind.json",
      "operationId": "gd-interrupted-upgrade-after-unbind-bind",
      "sha256": "8e9d341bd8527881c62a5384493c89e06c072542ddd94c8a7b88669ae05cbde8"
    },
    {
      "file": "gd-interrupted-upgrade-after-unload.json",
      "operationId": "gd-interrupted-upgrade-after-unload",
      "sha256": "8e910f1d08b4465af3a318746c49af8dff7b179e7e5c833b1862534d8614b745"
    },
    {
      "file": "gd-interrupted-upgrade-after-dkms-uninstall.json",
      "operationId": "gd-interrupted-upgrade-after-dkms-uninstall",
      "sha256": "22627b4271a6b912f2fc80ff7d48e3d23413cbb3965f63d4576ee0a1ef1963ea"
    },
    {
      "file": "gd-interrupted-upgrade-after-dkms-remove.json",
      "operationId": "gd-interrupted-upgrade-after-dkms-remove",
      "sha256": "21425c69f40cd0a58b327c2de6d841a36a21b9d3a0064d253cfdca0f4c7f0d17"
    },
    {
      "file": "gd-interrupted-upgrade-after-owned-residue-remove.json",
      "operationId": "gd-interrupted-upgrade-after-owned-residue-remove",
      "sha256": "97ee461702e9edf7ff97d501d1ad8b2ffe6595c5d164a09549f5f8908ed42440"
    },
    {
      "file": "gd-interrupted-upgrade-after-verify-final-state.json",
      "operationId": "gd-interrupted-upgrade-after-verify-final-state",
      "sha256": "f5ec398e94376c92b80a207ec53f16aacc98c371d286e6b3ae809be40d36e370"
    },
    {
      "file": "gd-interrupted-upgrade-after-commit-state.json",
      "operationId": "gd-interrupted-upgrade-after-commit-state",
      "sha256": "b048ae7fc2e0b6f833b36dd94f5c42dddda9bbcf168d8f03b971c5334d1a43f9"
    },
    {
      "file": "gd-stale-manifest-release.json",
      "operationId": "gd-stale-manifest-release",
      "sha256": "bb067b8cc02e83b43dccc4b368d50d0d85dd9f222e01b276b873c2ab15aa58fe"
    },
    {
      "file": "gd-stale-manifest-kernel.json",
      "operationId": "gd-stale-manifest-kernel",
      "sha256": "7237b9454f06d63f0afc39edd1fd66db87e897ebed308c10cffe21a66375ea0a"
    },
    {
      "file": "gd-stale-manifest-uapi.json",
      "operationId": "gd-stale-manifest-uapi",
      "sha256": "4ba2b882a8b1233f3069a3e998de820a110a54ac598217deb632d3813e2676b4"
    },
    {
      "file": "gd-stale-manifest-gpio4-overlay.json",
      "operationId": "gd-stale-manifest-gpio4-overlay",
      "sha256": "b1cd7bb48363402dd4d2acd98997e6e0d109fba75bd29725eb75f9eb55c21700"
    },
    {
      "file": "gd-stale-manifest-gpio20-overlay.json",
      "operationId": "gd-stale-manifest-gpio20-overlay",
      "sha256": "423f31dc9b6d39e1e21abe7102d4343029314716759d12c3a5f6b893c1216ded"
    },
    {
      "file": "gd-stale-manifest-enrollment.json",
      "operationId": "gd-stale-manifest-enrollment",
      "sha256": "87c5758635ee9c3082e398c19c0ffc628711b768b90afcf2fa965b791fb27e78"
    },
    {
      "file": "gd-corrupted-archive-or-dtbo-archive.json",
      "operationId": "gd-corrupted-archive-or-dtbo-archive",
      "sha256": "86c2c5980f0e972032b05d6e6190937f5cc16fc911abc5569be81a0a7afd1c06"
    },
    {
      "file": "gd-corrupted-archive-or-dtbo-gpio4-dtbo.json",
      "operationId": "gd-corrupted-archive-or-dtbo-gpio4-dtbo",
      "sha256": "59257fe3566f8aba7b6852206628508fae9c4a2b6631c881b3ef190eb6dc9edd"
    },
    {
      "file": "gd-corrupted-archive-or-dtbo-gpio20-dtbo.json",
      "operationId": "gd-corrupted-archive-or-dtbo-gpio20-dtbo",
      "sha256": "3d6204370d358a25c575bae384dfd7706a3a1add7194dd34db14647d2524810f"
    },
    {
      "file": "gd-removal-inactive-complete-removal.json",
      "operationId": "gd-removal-inactive-complete-removal",
      "sha256": "9027763ecdd28bd164375c8f9a6c1b65634b088e3c3e516d89355acbb93e8ada"
    },
    {
      "file": "gd-removal-open-or-active-open-gpio4.json",
      "operationId": "gd-removal-open-or-active-open-gpio4",
      "sha256": "efa27102d362c436d8099dbed1dc7f1e1a855fffdb21bd1bbcaed8fd02068fe9"
    },
    {
      "file": "gd-removal-open-or-active-owner-gpio4.json",
      "operationId": "gd-removal-open-or-active-owner-gpio4",
      "sha256": "ec9946943896944fd9c5eff8458369235a9d7d992f341416b2a2a319e16579ca"
    },
    {
      "file": "gd-removal-open-or-active-open-gpio20.json",
      "operationId": "gd-removal-open-or-active-open-gpio20",
      "sha256": "a03a1ce9c4db4713729d96f2ab15c088b966ef5423bf7f4184cc10c0b648d5b3"
    },
    {
      "file": "gd-removal-open-or-active-owner-gpio20.json",
      "operationId": "gd-removal-open-or-active-owner-gpio20",
      "sha256": "e21fbd49436f350473c64594f3b75559b96def4c87546d8cabf89c67515dc4b8"
    },
    {
      "file": "gd-reinstall-after-removal-gpio4.json",
      "operationId": "gd-reinstall-after-removal-gpio4",
      "sha256": "e80a0dffd5b44d66ddea6c3572d1243f62042551b7e3de9cdd3e12fe371b26cf"
    },
    {
      "file": "gd-reinstall-after-removal-gpio20.json",
      "operationId": "gd-reinstall-after-removal-gpio20",
      "sha256": "4add2efc9b7e3ae9cf16fb17ff5d1b2e98227c62de5cdf8262f44597f0cf950a"
    }
  ],
  "executors": {
    "attemptGenerator": {
      "path": "scripts/gate_d_attempts.py",
      "sha256": "6790c93aaee6502290540341f753ebbf2e80b78d813f86ac7e6d5a8de0568636"
    },
    "permanentExecutor": {
      "path": "scripts/gate_d_outer.py",
      "sha256": "d81824ab0454ecb298714e07c08ff9d81255d216152631e5285e51e08ac1d43f"
    }
  },
  "kind": "gate-d-attempt-index",
  "qualificationRoot": {
    "identityFile": ".gate-d-root.json",
    "identitySha256": "bb8d948edf62d89cd7f5f7488e822cab638420248a2685ff55adc22a0e719ccd",
    "mode": "0700",
    "ownerUid": 1000,
    "path": "/home/pi/gate-d-qualification/phase5.33-4208941af537"
  },
  "schemaVersion": 2
}
